{
  "schema_version": "early-bird-membership.command.v1",
  "account_id": "account_synthetic_0001",
  "membership_revision": 3,
  "state": "ACTIVE",
  "source": "PAYPAL",
  "offer": {
    "code": "EARLY_BIRDS_FOUNDERS_V1",
    "revision": 1
  },
  "effective_at": "2026-08-06T12:00:00Z",
  "paid_through": "2026-09-06T12:00:00Z",
  "grace_until": null,
  "provider": "paypal",
  "current_price": {
    "currency": "USD",
    "amount_minor": 200
  },
  "reason_code": "PAYMENT_SUCCEEDED"
}
